[
  {
    "name": "Aider polyglot benchmark",
    "family": "code editing / multi-language",
    "url": "https://aider.chat/docs/leaderboards/",
    "paper_url": "unknown",
    "what_it_measures": "Whole-file/diff code editing ability across six languages under a fixed two-attempt loop: solve the exercise, and if tests fail, retry once with the failing test output. Also measures edit-format compliance (can the model emit a syntactically valid diff).",
    "task_source": "225 of Exercism's hardest exercises across C++, Go, Java, JavaScript, Python, Rust (launched December 2024 to replace the saturated Python-only aider benchmark).",
    "metric": "pass_rate_2 (pass rate after two attempts) as primary; 'percent cases well-formed' (edit-format compliance) and total cost per run as secondary. Top entry: gpt-5 at 88.0% (run dated 2025-08-25).",
    "contamination_status": "Weak — Exercism exercises and their solutions are public and old; the benchmark's discriminative power comes from difficulty selection and the edit-format constraint, not contamination resistance. Scores near 88% suggest approaching saturation.",
    "maintenance_state": "stale — leaderboard page last updated 2025-11-20 but newest model runs date to 2025-08-25; no 2026-generation models listed as of July 2026.",
    "harness_lessons": "The well-formed-edits metric isolates a harness-critical variable most benchmarks conflate with intelligence: whether the model can drive YOUR edit format reliably, which is often the binding constraint in an agent loop. The one-retry-with-test-output protocol is a cheap, reproducible feedback-loop design worth copying. Publishing cost per run alongside accuracy made cost-normalized comparison standard practice.",
    "notes": "Third-party trackers (llm-stats.com/benchmarks/aider-polyglot, leaderboard.steel.dev) continue rescoring newer models against the same task set, so numbers for 2026 models exist outside the official page. Benchmark repo lives inside github.com/Aider-AI/aider (benchmark/ directory).",
    "slug": "aider-polyglot"
  },
  {
    "name": "Commit0",
    "family": "greenfield generation / spec-to-library",
    "url": "https://commit-0.github.io/",
    "paper_url": "https://arxiv.org/abs/2412.01769",
    "what_it_measures": "From-scratch library generation: given a specification document (often hundreds of pages) and an interactive unit-test suite, rebuild 57 core Python libraries so their tests pass — long-context spec reading, multi-stage test feedback, thousands of functions with real interdependencies.",
    "task_source": "57 real Python libraries stripped to specs + tests; lite/all splits; isolated per-library execution environments (Docker/Modal backends).",
    "metric": "Fraction of unit tests passed per library. SOTA at paper time: 17% of tests on the easier (lite) libraries, 6% across all libraries without feedback; no agent reproduces a full library.",
    "contamination_status": "Deliberately inverted — the target libraries ARE in every model's pretraining data, so the benchmark measures reconstruction from spec rather than memorization avoidance; verbatim recall of implementations is a confound the interactive-test protocol only partially controls.",
    "maintenance_state": "stale — repo (github.com/commit-0/commit0, MIT, 646 commits) last saw notable updates around late 2024 (o1 compatibility note 2024-09-28); still cited as a frontier target in 2026 papers (FeatureBench, RepoZero) because scores remain very low.",
    "harness_lessons": "Interactive test suites as the task definition (tests-as-spec) is the purest form of verifiable reward, and Commit0's distributed per-library sandboxes show the infra cost of scaling it. The gap between 17% on lite and 6% overall quantifies how fast agent competence decays with codebase size and interdependency, a decay curve worth measuring in your own harness before trusting an agent with a large repo.",
    "notes": "Useful contrast to SWE-Bench-style patching: 0-to-1 generation, not 1-to-n repair. Successor greenfield efforts: RepoZero (arXiv 2605.07122), 0-to-1 CLI-tool study (arXiv 2604.06742).",
    "slug": "commit0"
  },
  {
    "name": "FeatureBench",
    "family": "issue-resolution / feature development",
    "url": "https://arxiv.org/html/2602.10975v1",
    "paper_url": "https://arxiv.org/abs/2602.10975",
    "what_it_measures": "End-to-end feature development rather than bug patching: tasks span multiple commits/PRs and require implementing coherent feature-level functionality, the gap between SWE-bench-style repairs and real feature work.",
    "task_source": "200 evaluation tasks with 3,825 executable environments from 24 open-source repositories, auto-derived by tracing unit tests along dependency graphs to identify feature-scale units of work (scalable toolkit, refreshable over time).",
    "metric": "Task resolution rate via test verification. Claude Opus 4.5 scores 11.0% vs its 74.4% on SWE-bench — a ~63-point drop on the same model.",
    "contamination_status": "Mined from public repos (exposed), but the automated collection toolkit is explicitly designed to regenerate fresh post-cutoff tasks over time, making refresh the contamination strategy rather than secrecy.",
    "maintenance_state": "active — submitted 2026-02-11, accepted ICLR 2026; first public version; refresh pipeline promised.",
    "harness_lessons": "Auto-deriving tasks from test dependency graphs is a template for building an eval from your own repo without hand-annotation, which is the only way internal benchmarks stay fresh. The 74%-to-11% collapse from bug-fix to feature-scale tasks quantifies task-granularity as the dominant difficulty variable: agent reliability numbers are meaningless without stating the size of the unit of work.",
    "notes": "Part of the 2026 wave restoring headroom after SWE-bench saturation (with SWE-Bench Pro, RoadmapBench arXiv 2605.15846, SmellBench arXiv 2606.05574, ContextBench arXiv 2602.05892). Authors: Qixing Zhou, Jiacheng Zhang, et al.",
    "slug": "featurebench"
  },
  {
    "name": "HAL — Holistic Agent Leaderboard",
    "family": "meta / evaluation infrastructure",
    "url": "https://hal.cs.princeton.edu/",
    "paper_url": "https://arxiv.org/abs/2510.11977",
    "what_it_measures": "Not a task set: a standardized, centralized harness for running third-party agents across many benchmarks (SWE-bench Verified, USACO, AppWorld, CORE-bench, tau-bench, ...) with identical orchestration, so cross-benchmark and cross-agent numbers are comparable and cost-annotated.",
    "task_source": "Wraps existing benchmarks; validation campaign: 21,730 agent rollouts, 9 models x 9 benchmarks across coding, web, science, customer service, ~$40k total cost.",
    "metric": "Per-benchmark accuracy plus dollar cost per run (cost-accuracy Pareto frontiers), with parallel execution across hundreds of VMs.",
    "contamination_status": "Inherits each wrapped benchmark's contamination profile; its own contribution is eliminating implementation-variance confounds (harness bugs) rather than leakage control.",
    "maintenance_state": "frozen/pivoted — hal-harness repo (princeton-pli/hal-harness) archived for historical reference; the team (Stroebl, Kapoor, Narayanan; ICLR 2026 paper) has pivoted to the HAL Reliability Dashboard (hal.cs.princeton.edu/reliability) and the cross-org AI Evaluator Forum.",
    "harness_lessons": "Their core finding is this book's thesis in benchmark form: a shared harness 'eliminates common implementation bugs' that otherwise dominate reported differences between agents, and evaluation cost (~$40k for one validation sweep) is a first-class engineering constraint. The pivot from leaderboard to reliability dashboard is the field's measurement frontier moving from 'how capable' to 'how consistently', the exact framing of Part Measurement.",
    "notes": "Cite alongside Inspect (UK AISI) and Harbor as the three public reference harnesses of 2025-2026. Cost-of-evals context: huggingface.co/blog/evaleval/eval-costs-bottleneck; 'Efficient Benchmarking of AI Agents' arXiv 2603.23749.",
    "slug": "hal-harness"
  },
  {
    "name": "LiveCodeBench",
    "family": "competitive programming / contamination-controlled",
    "url": "https://livecodebench.github.io/",
    "paper_url": "https://arxiv.org/abs/2403.07974",
    "what_it_measures": "Four code capabilities beyond generation: code generation, self-repair, code execution (predict behavior without running), and test-output prediction, evaluated as a function of problem release date to expose contamination.",
    "task_source": "Problems continuously scraped from LeetCode, AtCoder, and Codeforces contests, tagged with release dates. Rolling versions: v1 400 problems (May 2023-Mar 2024) through v6 1055 problems (May 2023-Apr 2025).",
    "metric": "pass@1 (and pass@5) against hidden test cases, sliceable by time window so models are scored only on problems released after their training cutoff.",
    "contamination_status": "Contamination-aware by construction — the date-windowing design is the whole point; performance drop-off on post-cutoff windows is used as a leakage detector. Requires trusting vendor-declared cutoffs.",
    "maintenance_state": "active — GitHub repo maintained with dataset expansions through 2025 (v6 = Apr 2025 window); third-party leaderboards (artificialanalysis.ai, benchlm.ai) rescore 2026 models on it; official version cadence has slowed relative to 2024.",
    "harness_lessons": "Date-stamping every task and slicing metrics by time window is the cheapest robust contamination control available, and it transfers directly to internal eval suites built from your own issue history. Measuring self-repair and execution-prediction separately from generation shows how to decompose 'coding ability' into the sub-skills your harness actually exercises.",